{
    "$schema": "https://raw.githubusercontent.com/Outsmart-OOH/ooh_open_direct/master/schema/v1/uris/products/products_avails_request.json",
    "AccountId": "23873345",
    "EndDate": "2014-12-10T18:00:00.000Z",
    "ProductIds": [
        "456367"
    ],
    "StartDate": "2014-12-05T06:00:00.000Z",
    "AvailabilityFields": [
        {
            "Name": "Inventory",
            "Type": "Frames",
            "DataSource": "Space",
            "Target": "frame_id"
        },
        {
            "Name": "Delivery",
            "Type": "Frames",
            "DataSource": "Time",
            "Target": "Days"
        },
        {
            "Name": "Delivery",
            "Type": "Frames",
            "DataSource": "Time",
            "Target": "Hours"
        },
        {
            "Name": "Delivery",
            "Type": "Frames",
            "DataSource": "ShareOfDisplay",
            "Target": "ShareOfTime"
        },
        {
            "Name": "Inventory",
            "Type": "Audience",
            "DataSource": "Metrics",
            "Target": "Impacts"
        },
        {
            "Name": "Investment",
            "Type": "Total",
            "DataSource": "GBP",
            "Target": "Fixed"
        }
    ],
    "Grouping": [
        {
            "Name": "Inventory",
            "Type": "Frames",
            "DataSource": "Space",
            "Target": "frame_id"
        },
        {
            "Name": "Delivery",
            "Type": "Frames",
            "DataSource": "Time",
            "Target": "Days"
        },
        {
            "Name": "Delivery",
            "Type": "Frames",
            "DataSource": "Time",
            "Target": "Hours"
        }
    ],
    "Targeting": [
        {
            "Name": "Inventory",
            "Type": "Frames",
            "DataSource": "Space",
            "Target": "frame_id",
            "TargetValues": [
                "1234931339"
            ]
        },
        {
            "Name": "Delivery",
            "Type": "Frames",
            "DataSource": "Time",
            "Target": "Hours",
            "TargetValues": [
                "5",
                "6"
            ]
        },
        {
            "Name": "Delivery",
            "Type": "Frames",
            "DataSource": "Time",
            "Target": "Day",
            "TargetValues": [
                "1",
                "2"
            ]
        },
        {
            "Name": "Delivery",
            "Type": "Frames",
            "DataSource": "ShareOfDisplay",
            "Target": "ShareOfTime",
            "TargetValues": [
                "20"
            ]
        }
    ]
}