{
    "$schema": "https://raw.githubusercontent.com/Outsmart-OOH/ooh_open_direct/master/schema/v1/uris/products/products_avails_request.json",
    "AccountId": "23873345",
    "EndDate": "2014-12-10T18:00:00.000Z",
    "ProductIds": [ "456366" ],
    "StartDate": "2014-12-05T06:00:00.000Z",

    "AvailabilityFields": [


        {
            "Name": "Inventory",
            "Type": "Frames",
            "DataSource": "Space",
            "Target": "frame_id"
        },
        {
            "Name": "Delivery",
            "Type": "Frames",
            "DataSource": "ShareOfDisplay",
            "Target": "ShareOfTime"
        },
        {
            "Name": "Inventory",
            "Type": "Audience",
            "DataSource": "Metrics",
            "Target": "Impacts"
        },
        {
            "Name": "Investment",
            "Type": "Total",
            "DataSource": "GBP",
            "Target": "Fixed"
        }


    ],


    "Grouping": [
        {
            "Name": "Inventory",
            "Type": "Frames",
            "DataSource": "Space",
            "Target": "frame_id"
        }
    ],

    "Targeting": [
        {
            "Name": "Inventory",
            "Type": "Frames",
            "DataSource": "<SPACE>",
            "Target": "<frame_id>",
            "TargetValues": [
                "1234931339",
                "1235190735",
                "1234931338",
                "1235191547"
            ]
        },
        {
            "Name": "Inventory",
            "Type": "Audience",
            "DataSource": "<ROUTE>",
            "Target": "<age>",
            "TargetValues": [
                "15-17",
                "18-24",
                "25-29"
            ]
        },
        {
            "Name": "Inventory",
            "Type": "Audience",
            "DataSource": "<ROUTE>",
            "Target": "<sex>",
            "TargetValues": [
                "Female"
            ]
        },
        {
            "Name": "Inventory",
            "Type": "Audience",
            "DataSource": "<ROUTE>",
            "Target": "<affluence>",
            "TargetValues": [
                "A",
                "B",
                "C1"
            ]
        },
        {
            "Name": "Inventory",
            "Type": "Audience",
            "DataSource": "Metrics",
            "Target": "Impacts",
            "TargetValues": ["8000"]
        }

    ]
} 
